{
  "$schema": "../schemas/worker-routing.schema.json",
  "version": 1,
  "default_command": "копай",
  "task_type_to_role": {
    "campaign": "dispatcher",
    "source_scan": "source-researcher",
    "open_web_discovery": "open-web-discovery",
    "extract_observations": "extractor",
    "investigate_claim": "corroborator",
    "source_profile_review": "source-analyst",
    "map_update": "geo-verifier",
    "daily_report": "report-editor",
    "weekly_report": "report-editor",
    "snapshot_report": "report-editor",
    "translate_report": "translator",
    "correction": "correction-editor",
    "validation": "release-validator"
  },
  "agent_files": {
    "dispatcher": ".github/agents/dispatcher.agent.md",
    "source-researcher": ".github/agents/source-researcher.agent.md",
    "open-web-discovery": ".github/agents/open-web-discovery.agent.md",
    "extractor": ".github/agents/extractor.agent.md",
    "corroborator": ".github/agents/corroborator.agent.md",
    "source-analyst": ".github/agents/source-analyst.agent.md",
    "geo-verifier": ".github/agents/geo-verifier.agent.md",
    "report-editor": ".github/agents/report-editor.agent.md",
    "translator": ".github/agents/translator.agent.md",
    "correction-editor": ".github/agents/correction-editor.agent.md",
    "release-validator": ".github/agents/release-validator.agent.md"
  }
}
